{
  "$schema": "https://json-schema.org/draft/2020-12/schema",
  "title": "Services",
  "type": "array",
  "items": {
    "type": "object",
    "additionalProperties": false,
    "required": ["slug", "title", "summary", "highlights"],
    "properties": {
      "slug": { "type": "string", "minLength": 1 },
      "title": { "type": "string", "minLength": 1 },
      "summary": { "type": "string", "minLength": 1 },
      "highlights": {
        "type": "array",
        "minItems": 1,
        "items": { "type": "string", "minLength": 1 }
      }
    }
  }
}
